{
  "schema_version": "secret-0002-signature-0.1",
  "request_id": "sigreq.signing.20260414.001",
  "session_id": "session.req.signing.20260412.001",
  "bridge_trace": "trace.signing.20260412.001",
  "decision": "allow",
  "signature": {
    "format": "hex-65",
    "value": "0xbbbbbbbbbbbbbbbbbbbbbbbbbbbbbbbbbbbbbbbbbbbbbbbbbbbbbbbbbbbbbbbbbbbbbbbbbbbbbbbbbbbbbbbbbbbbbbbbbbbbbbbbbbbbbbbbbbbbbbbbbbbbbb"
  },
  "signer_identity": {
    "key_ref": "hsmop://secret.signing.release-artifact/req.signing.20260412.001"
  }
}
